{
    "$schema": "./rules.schema.json",
    "version": 1,
    "stance": "These rules are a prescriptive target for new and reworked wave nodes, not a description of what any existing catalog already looks like.",
    "overridesFile": "create-high5-nodes.config.json",
    "rules": [
        {
            "id": "boolean-default-required",
            "title": "BOOLEAN inputs always declare a defaultValue",
            "class": "engine",
            "scope": "input-type",
            "statement": "Declare a literal true/false defaultValue on every BOOLEAN input and never mark a BOOLEAN mandatory: false without one.",
            "rationale": "Stream Designer renders BOOLEAN as a checkbox with no unset state, so an absent default resolves to undefined despite the UI showing unchecked.",
            "enforcedBy": "lint",
            "lintRule": "boolean-default-required",
            "overridable": false,
            "incorrect": [
                "{ name: Input.VERIFY_TLS, type: BOOLEAN, mandatory: false }"
            ],
            "correct": [
                "{ name: Input.VERIFY_TLS, type: BOOLEAN, example: true, defaultValue: true, advanced: true }"
            ],
            "source": "references/input-type-rules.md#boolean"
        },
        {
            "id": "example-required",
            "title": "Every input and output declares an example",
            "class": "engine",
            "scope": "spec",
            "statement": "Give every inputs[] and outputs[] entry a realistic example value.",
            "rationale": "The hcloud-sdk StreamNodeSpecificationInput/Output types mark example as required, so a missing one either fails to typecheck or ships an unhelpful blank placeholder in Stream Designer.",
            "enforcedBy": "lint",
            "lintRule": "example-required",
            "overridable": false,
            "incorrect": [
                "{ name: Input.TASK_ID, description: \"Enter the task id\", type: STRING, mandatory: true }"
            ],
            "correct": [
                "{ name: Input.TASK_ID, description: \"Enter the task id\", type: STRING, example: \"abc123\", mandatory: true }"
            ],
            "source": "references/specification.md#input-optional-fields"
        },
        {
            "id": "input-output-description-required",
            "title": "Every input and output declares a description",
            "class": "engine",
            "scope": "spec",
            "statement": "Give every inputs[] and outputs[] entry a description string.",
            "rationale": "V3 requires description on every input/output entry; the hcloud-sdk types make the field non-optional so tsc catches an omission.",
            "enforcedBy": "typecheck",
            "overridable": false,
            "incorrect": [
                "{ name: Output.TASK_ID, type: STRING, example: \"abc123\" }"
            ],
            "correct": [
                "{ name: Output.TASK_ID, description: \"Returns the id of the created task\", type: STRING, example: \"abc123\" }"
            ],
            "source": "references/specification.md#v3-fields-the-default-for-new-nodes"
        },
        {
            "id": "spec-version-v3",
            "title": "New nodes declare specVersion 3",
            "class": "engine",
            "scope": "spec",
            "statement": "Author new nodes with specVersion: 3 and deprecated: false; leave V4 on ice and don't start new nodes on V1/V2.",
            "rationale": "The engine source validates spec versions 1 to 3 only and the SDK version the blueprint pins has no V4 type, so V4 conditional inputs are on ice until the engine team confirms a release that executes them.",
            "enforcedBy": "agent",
            "overridable": false,
            "incorrect": [
                "specification: StreamNodeSpecificationV2 = { name: \"...\", ... }"
            ],
            "correct": [
                "specification: StreamNodeSpecificationV3 = { specVersion: 3, deprecated: false, ... }"
            ],
            "source": "references/specification.md#pick-a-spec-version"
        },
        {
            "id": "enum-io-names",
            "title": "Name inputs and outputs through a local enum",
            "class": "engine",
            "scope": "spec",
            "statement": "Declare a local enum Input and enum Output per node and reference members (name: Input.TASK_ID) instead of inline string literals.",
            "rationale": "Tests, lint rules, and this skill's own AST helpers resolve enum members to their display string and report at the declaration site; inline literals are also fine to the engine but the enum is the established, lint-verified convention.",
            "enforcedBy": "agent",
            "overridable": false,
            "incorrect": [
                "{ name: \"Task id\", type: STRING, example: \"abc123\" }"
            ],
            "correct": [
                "enum Output { TASK_ID = \"Task id\" }",
                "{ name: Output.TASK_ID, type: STRING, example: \"abc123\" }"
            ],
            "source": "references/house-style-vs-user-style.md#whats-engine-mandatory-not-overridable"
        },
        {
            "id": "credentials-string-password",
            "title": "Credential inputs are always STRING_PASSWORD",
            "class": "engine",
            "scope": "input-type",
            "statement": "Type every credential input (API key, bearer token, password, secret) as STRING_PASSWORD, with no exceptions.",
            "rationale": "STRING_PASSWORD masks the value in the Stream Designer UI; STRING renders it in plaintext to anyone who can see the panel.",
            "enforcedBy": "agent",
            "overridable": false,
            "incorrect": [
                "{ name: Input.API_KEY, type: STRING, example: \"abc123def456\" }"
            ],
            "correct": [
                "{ name: Input.API_KEY, type: STRING_PASSWORD, example: \"abc123def456\" }"
            ],
            "source": "references/secrets-and-auth.md#declaring-a-credential-input"
        },
        {
            "id": "no-log-string-password",
            "title": "Never log a STRING_PASSWORD value",
            "class": "engine",
            "scope": "security",
            "statement": "Never pass a STRING_PASSWORD input's value to addNodeLog, console.log, or any output.",
            "rationale": "The engine does not auto-redact STRING_PASSWORD from logs, so logging it surfaces the credential to anyone who can see node logs.",
            "enforcedBy": "agent",
            "overridable": false,
            "incorrect": [
                "this.wave.logger.addNodeLog(`token=${apiKey}`);"
            ],
            "correct": [
                "this.wave.logger.addNodeLog(\"Authenticated request sent\");"
            ],
            "source": "references/errors.md#the-pattern-in-code"
        },
        {
            "id": "no-secret-store-in-execute",
            "title": "Never call the secret store from execute()",
            "class": "engine",
            "scope": "security",
            "statement": "Read credentials only from a STRING_PASSWORD input; never call the helmut.cloud secret store API from inside execute().",
            "rationale": "The user's supply mechanism (a literal, an upstream Get Secret node, a stream variable) is their choice, not the node's; calling the vault directly hard-codes the node to one org/space and breaks portability.",
            "enforcedBy": "agent",
            "overridable": false,
            "incorrect": [
                "const secret = await wave.general.getHcloudClient().High5.space.secret.getSecret(id);"
            ],
            "correct": [
                "const secret = this.wave.inputs.getInputValueByInputName(Input.API_KEY) as string;"
            ],
            "source": "references/secrets-and-auth.md#the-node-authors-rule-accept-credentials-as-inputs"
        },
        {
            "id": "throw-to-fail",
            "title": "Throw to fail; never invent an error output",
            "class": "engine",
            "scope": "error-message",
            "statement": "Signal failure by throwing an Error from execute(); never add a custom Output.ERROR_MESSAGE-style field.",
            "rationale": "The engine catches any thrown error, takes the Fail edge, and surfaces the message verbatim; a resolved execute() always takes Success, so a parallel error-output field just splits the API the engine already provides.",
            "enforcedBy": "agent",
            "overridable": false,
            "incorrect": [
                "this.wave.outputs.setOutput(Output.ERROR_MESSAGE, \"failed\"); return;"
            ],
            "correct": [
                "throw new Error(\"Could not retrieve resource — server returned 404 — verify the resource id\");"
            ],
            "source": "references/errors.md#how-the-engine-handles-errors"
        },
        {
            "id": "no-shell-string-injection",
            "title": "Never pass resolved input into a shell string",
            "class": "engine",
            "scope": "security",
            "statement": "Never pass a wildcard-resolved value to exec/execSync, a template-string command, or spawn/execa with shell: true. The single exception is a node whose entire product is arbitrary command execution (a command-runner node, never one wrapping a specific CLI), and only after the human has explicitly accepted the risk as a stated decision in the contract review block — never as a no-reply-fallback assumption — with the full hardening checklist still applied.",
            "rationale": "Resolved input is attacker-controlled network input by the time execute() runs; a shell string turns that into remote code execution on the customer's host.",
            "enforcedBy": "agent",
            "overridable": false,
            "incorrect": [
                "exec(`kubectl get pod ${podName}`);"
            ],